,tweets,id,date,source,lang,place,sentiment,tweet_bersih
0,"RT @zeusyeet: 💰 500 $TRX #Giveaway

 To enter the giveaway:

☑️Follow me &amp; @ASLAproject
☑️Retweet and Like
☑️Tag 2 friends

⏰Rolling in 2 D…",1238469018702364675,2020-03-13 14:16:38,Twitter for Android,en,,Netral, 500 trx giveaway to enter the giveaway follow me amp retweet and like tag 2 friends rolling in 2 d 
1,RT @Cointelegraph: Cryptocurrency adoption will fasten economic growth and development in Africa https://t.co/Ha66e2Lmfe,1238469001765892097,2020-03-13 14:16:34,Twitter for Android,en,,Positif, cryptocurrency adoption will fasten economic growth and development in africa 
2,"RT @zeusyeet: 💰 $10 $BTC #Giveaway

 To enter the giveaway:

⭐ Follow @BE_podcast &amp; @BE_giveaways
⭐ Retweet and Like this Tweet
⭐ Tag 3 fri…",1238468978105696256,2020-03-13 14:16:28,Twitter for Android,en,,Netral, 10 btc giveaway to enter the giveaway follow amp retweet and like this tweet tag 3 fri 
3,"Illinois Can Claim ‘Abandoned’ Cryptocurrency Under New Bill
https://t.co/Ib8lxioJoV
#Regulation, #BTC",1238468894358228994,2020-03-13 14:16:08,bFol00,en,,Positif,illinois can claim abandoned cryptocurrency under new bill regulation btc
4,"#Prices Drop: #Bitcoin, #Cardano, #Stocks, #Gold, &amp; #Crypto #News

#blockchain #Cryptocurrency #finance #fintech… https://t.co/NM8xMYbIvz",1238468886959394817,2020-03-13 14:16:06,Twitter for Android,en,,Netral,prices drop bitcoin cardano stocks gold amp crypto news blockchain cryptocurrency finance fintech 
5,"One of #Bitcoin ’s Biggest Asset Managers Says #Zcash Could Hit $60,000 in 2025 – 

⁦@FortuneMagazine⁩ ⁦… https://t.co/kG5b2Isp2Z",1238468885973798914,2020-03-13 14:16:06,Twitter for iPhone,en,,Netral,one of bitcoin s biggest asset managers says zcash could hit 60000 in 2025 
6,50 Companies Back New Cryptocurrency Project Competing With Facebook’s Libra https://t.co/jl2t6LUotG https://t.co/tklb1i6Elo,1238468885373956097,2020-03-13 14:16:06,WordPress.com,en,,Positif,50 companies back new cryptocurrency project competing with facebook s libra 
7,"@timdraper states on blockchain mass adoption “Bitcoin is awesome, and when Lightning Network and OpenNode deliver,… https://t.co/Q0boIHQAbV",1238468861600641024,2020-03-13 14:16:00,Buffer,en,,Positif, states on blockchain mass adoption bitcoin is awesome and when lightning network and opennode deliver 
8,Friends #EQToken offers a more efficient way to offer and issue shares to users who even have little funds and beco… https://t.co/rRojZOx062,1238468859398483968,2020-03-13 14:16:00,Twitter Web App,en,,Positif,friends eqtoken offers a more efficient way to offer and issue shares to users who even have little funds and beco 
9,RT @cryptanalyser: #BTCUSD Market #1H timeframe on  March 13 at 13:00 (UTC)  is #Bearish.  #cryptocurrency #bitcoin  #btc #crypto #trading…,1238468783208988673,2020-03-13 14:15:42,Twitter Web App,en,,Netral, btcusd market 1h timeframe on march 13 at 1300 utc is bearish cryptocurrency bitcoin btc crypto trading 
10,"RT @IrishGirlCrypt1: 🚨FLASH #Bitcoin #Crypto #Giveaway🚨

🎁WINNER GETS 0.0041 #BTC 🤑

🧜‍♀️Rules:

✅Like &amp; Retweet

✅Follow  @Gibsooncorp &amp; @…",1238468694252150784,2020-03-13 14:15:21,Twitter Web App,en,,Netral, flash bitcoin crypto giveaway winner gets 00041 btc rules like amp retweet follow amp 
11,#bitcoin bloodbath: What people are saying about the crypto collapse #cryptocurrency https://t.co/3FVCh8CHWu https://t.co/OwR1qTz75E,1238468686568132611,2020-03-13 14:15:19,bitcoinagile,en,,Netral,bitcoin bloodbath what people are saying about the crypto collapse cryptocurrency 
12,Cryptocurrency Mining Rigs - https://t.co/JSWbcBdNkk - #bitcoin #blockchain #ethereum #crypto #cryptocurrency… https://t.co/vMWY8nmvYY,1238468684936511488,2020-03-13 14:15:18,IFTTT,en,,Netral,cryptocurrency mining rigs   bitcoin blockchain ethereum crypto cryptocurrency 
13,Cryptocurrencies are now classed as financial instruments in Germany.  #BaFin #cryptocurrency #Bitcoin… https://t.co/plLzlv57T6,1238468684018069505,2020-03-13 14:15:18,Hootsuite Inc.,en,,Netral,cryptocurrencies are now classed as financial instruments in germany bafin cryptocurrency bitcoin 
14,"Chainlink Sees Shocking Correction, Plummets by Over 40% https://t.co/DeKEsFm417
#Blockchain, #Bitcoin, #Chainlink,… https://t.co/VQedFFK6Iw",1238468671359586308,2020-03-13 14:15:15,CoinIdol.com,en,,Negatif,chainlink sees shocking correction plummets by over 40 blockchain bitcoin chainlink 
16,"Cryptocurrencies have taken an absolute battering in the past week, fears surround the global pandemic continue to… https://t.co/JboKjlVzbq",1238468651973566464,2020-03-13 14:15:10,Twitter for iPhone,en,,Negatif,cryptocurrencies have taken an absolute battering in the past week fears surround the global pandemic continue to 
17,"RT @VoskCoin: Go ""Deeper In The Mines"" with VoskCoin as we tour the biggest and craziest Bitcoin cryptocurrency mining farms from around th…",1238468646101487617,2020-03-13 14:15:09,Twitter Web Client,en,,Netral, go deeper in the mines with voskcoin as we tour the biggest and craziest bitcoin cryptocurrency mining farms from around th 
18,"RT @LinkupVe: #URGENTE 
⌛ #Linkup is next #app #Giveaway #blockchain #EOS that gives you #Cryptocurrency #FREE for being connected 

Send D…",1238468616158240769,2020-03-13 14:15:02,Twitter for Android,en,,Positif, urgente linkup is next app giveaway blockchain eos that gives you cryptocurrency free for being connected send d 
19,Defining Cryptocurrency Is the Best Way to Kill It https://t.co/lL1O7s9xuS https://t.co/pHqYAeQCEF,1238468609606893568,2020-03-13 14:15:00,WordPress.com,en,,Positif,defining cryptocurrency is the best way to kill it 
20,@TheTokenJT Coinbaseeeee start with Bitcoin and Cryptocurrency 💪🏾,1238468537397784579,2020-03-13 14:14:43,Twitter for iPhone,en,,Netral, coinbaseeeee start with bitcoin and cryptocurrency 
21,"If cryptocurrency tickles your interest, give this a listen !

Or if you just want to hear my sweet sweet voice 😏 https://t.co/hLnHLXKyH3",1238468503428046848,2020-03-13 14:14:35,Twitter for Android,en,,Positif,if cryptocurrency tickles your interest give this a listen  or if you just want to hear my sweet sweet voice 
22,#Obyte's autonomous agents in flight for DeFi-ant fight: https://t.co/sjie5a38bP #fintech #DecentralisedFinance #Cryptocurrency @ObyteOrg,1238468451947229190,2020-03-13 14:14:23,Twitter Web App,en,,Positif,obytes autonomous agents in flight for defiant fight fintech decentralisedfinance cryptocurrency 
23,"RT @LedgerInsights: Yesterday's financial carnage highlighted the flaws in some public blockchain #DeFi solutions

But more importantly, it…",1238468444930150400,2020-03-13 14:14:21,Twitter for Android,en,,Positif, yesterdays financial carnage highlighted the flaws in some public blockchain defi solutions but more importantly it 
24,"Earning #cryptocurrency for selling my stuff on @Listia! Join me using code ""DHZPWZ"" for an extra 100 XNK. I just l… https://t.co/fn9Pj7uzQk",1238468428228427780,2020-03-13 14:14:17,Listia,en,,Netral,earning cryptocurrency for selling my stuff on join me using code dhzpwz for an extra 100 xnk i just l 
26,"RT @beincrypto: 🔻Exchange Issue poll 🔻

Since the recent #crypto market bloodbath users of #cryptocurrency exchanges have reported issues.…",1238468392316571654,2020-03-13 14:14:09,Twitter for Android,en,,Netral, exchange issue poll since the recent crypto market bloodbath users of cryptocurrency exchanges have reported issues 
27,"Join FaucetPay for multiple easy #cryptocurrency and #bitcoin #earning sites!!
https://t.co/mNuX8Gip6L https://t.co/EzVDgL9xGD",1238468362574929927,2020-03-13 14:14:01,Buffer,en,,Positif,join faucetpay for multiple easy cryptocurrency and bitcoin earning sites 
30,"New article: ""Amazon's Maria Renz moves to digital lender SoFi | FinTech"" has been published on Fintech Zoom -… https://t.co/qm0rm601ag",1238468340391297024,2020-03-13 14:13:56,App for FintechZoom.com,en,,Positif,new article amazons maria renz moves to digital lender sofi  fintech has been published on fintech zoom  
31,Latoken New Update And Cryptocurrency News. https://t.co/imh83BVTY1 via @YouTube,1238468327267155974,2020-03-13 14:13:53,Twitter Web Client,en,,Positif,latoken new update and cryptocurrency news via 
32,"@CeloOrg  announces a new #crypto alliance as it takes on #Libra

will watch this carefully....but it makes sense..… https://t.co/H9oRsr4qDg",1238468312662708226,2020-03-13 14:13:50,Twitter Web App,en,,Positif, announces a new crypto alliance as it takes on libra will watch this carefullybut it makes sense 
33,"There was a historic price crash in the entire cryptocurrency market yesterday with Bitcoin, Ethereum and XRP all b… https://t.co/bqjJZs9ZIZ",1238468302160244741,2020-03-13 14:13:47,Twitter Web Client,en,,Netral,there was a historic price crash in the entire cryptocurrency market yesterday with bitcoin ethereum and xrp all b 
34,"RT @bilmez_yasin: https://t.co/2A07DcO3DQ go and mine free
To get WebDollar early just go to https://t.co/G19u0Si0NH and buy
#webdollar #cr…",1238468293700268033,2020-03-13 14:13:45,Twitter for Android,en,,Positif, go and mine free to get webdollar early just go to and buy webdollar cr 
35,"RT @Bitspay_io: BEAM has been listed on BITSPAY
Trading pairs: BEAM/BTC, BEAM/ETH, BEAM/USDT, BEAM/USDC
Enjoy your trading: https://t.co/fG…",1238468292966109184,2020-03-13 14:13:45,Mobile Web (M2),en,,Positif, beam has been listed on bitspay trading pairs beambtc beameth beamusdt beamusdc enjoy your trading 
36,"RT @cryptobrice: 🚨$20 #BTC #Giveaway 

⭐️Follow @Csgostep_com 
⭐️Like+RT
⭐️Tag 2 Friends Or More

⏰Rolling in 48 hours!!

☘️Good Luck Every…",1238468291913375744,2020-03-13 14:13:45,Twitter for Android,en,,Positif, 20 btc giveaway follow likert tag 2 friends or more rolling in 48 hours good luck every 
37,"So who else sees a bunch of inverse H&amp;S forming on LTF charts? 

#letsallgetrich #Crypto #cryptocurrency… https://t.co/pcw9UmRUSN",1238468285852602369,2020-03-13 14:13:43,Twitter for Android,en,,Netral,so who else sees a bunch of inverse hamps forming on ltf charts letsallgetrich crypto cryptocurrency 
38,"RT @CreamPress: With privacy @SovranoCoin_svr , Bitluxury wants to make shopping as secure as possible for the customers
https://t.co/tFwGt…",1238468279540133888,2020-03-13 14:13:42,Twitter for Android,en,,Positif, with privacy  bitluxury wants to make shopping as secure as possible for the customers 
39,"Cryptocurrency #Payments provider #CoinPip has shut down, but possibly only temporarily. 

The #Singapore-based… https://t.co/Kx0XFErgbE",1238468277921132544,2020-03-13 14:13:41,1buvtw,en,,Negatif,cryptocurrency payments provider coinpip has shut down but possibly only temporarily the singaporebased 
41,"RT @SirToshiTV: #XRPCommunity: See ya, wouldn't wanna be ya!!!🤦‍♂️🎓
""In a heavy move against the third-largest cryptocurrency by market cap…",1238468205292765184,2020-03-13 14:13:24,Twitter Web App,en,,Negatif, xrpcommunity see ya wouldnt wanna be ya in a heavy move against the thirdlargest cryptocurrency by market cap 
42,"@swapzillaco A great project to invest your money. It 's built on cryptocurrency, it has a great team, a good idea… https://t.co/0b4pN9snK3",1238468203015217152,2020-03-13 14:13:23,Twitter Web App,en,,Positif, a great project to invest your money it s built on cryptocurrency it has a great team a good idea 
43,RT @DakotaDS: I couldn’t agree more. #XRP $XRP #cryptocurrency  I KNOW WHAT I HOLD. 😏 Let’s go; bring the blood bath. I can hold my breath…,1238468197797507072,2020-03-13 14:13:22,Twitter for iPhone,en,,Positif, i couldn t agree more xrp xrp cryptocurrency i know what i hold let s go bring the blood bath i can hold my breath 
44,@AtomarsExchange @DAPScoin @electroneum @Energicrypto @kava_labs @artiqox @AtomicWallet @oceanprotocol @MinterTeam… https://t.co/pJxt5I34xB,1238468179887894528,2020-03-13 14:13:18,Twitter for Android,en,,Netral, 
45,"RT @trailingcrypto: TrailingCrypto (https://t.co/80pZ3OtzqP) is now listed on https://t.co/AdFMJNJYJC

Follow @trailingcrypto and @coincode…",1238468167262846976,2020-03-13 14:13:15,Twitter for Android,en,,Netral, trailingcrypto  is now listed on follow and 
46,"RT @CallistoSupport: Because miners matter, #CallistoNetwork designed the ""Dynamic Gas Price"" feature with the aim of ensuring a minimum in…",1238468166654754817,2020-03-13 14:13:15,Twitter for Android,en,,Netral, because miners matter callistonetwork designed the dynamic gas price feature with the aim of ensuring a minimum in 
47,RT @patrickluberus: Wanna see something crazy? 👀 The #Nano beta has officially passed 1000 CPS during a stress test 😎 This is real 1st laye…,1238468164893237248,2020-03-13 14:13:14,Twitter for Android,en,,Negatif, wanna see something crazy the nano beta has officially passed 1000 cps during a stress test this is real 1st laye 
48,"@BitMEXdotcom Frantically Went Down to Prevent Panic Bitcoin Sell-Off: FTX CEO

#Cryptocurrency #CryptoNews… https://t.co/D6IesD1rKQ",1238468116415315973,2020-03-13 14:13:03,Twitter Web App,en,,Negatif, frantically went down to prevent panic bitcoin selloff ftx ceo cryptocurrency cryptonews 
49,"New article: ""Karbon Talks India Commercial Card Adption"" has been published on Fintech Zoom -… https://t.co/ChpeJmput4",1238468101127262209,2020-03-13 14:12:59,App for FintechZoom.com,en,,Positif,new article karbon talks india commercial card adption has been published on fintech zoom  
50,From the man himself.  https://t.co/5fdOTDaiC3,1238468034559389696,2020-03-13 14:12:43,Twitter for iPhone,en,,Netral,from the man himself 
51,"RT @_Cardano_ADA: Charles Hoskinson, CEO of IOHK, confirmed Cardano updates are due to be rolled out soon https://t.co/DTh1l3eS7l
-
#Blockc…",1238467986840793088,2020-03-13 14:12:32,Twitter Web App,en,,Positif, charles hoskinson ceo of iohk confirmed cardano updates are due to be rolled out soon  blockc 
52,"New article: ""roads, hospitals – and student loans?"" has been published on Fintech Zoom - https://t.co/NmwzG8L06K… https://t.co/zEjEDAcz68",1238467940837666817,2020-03-13 14:12:21,App for FintechZoom.com,en,,Positif,new article roads hospitals and student loans has been published on fintech zoom  
53,Crash of a Generation https://t.co/HHt0OfZzax #cryptocurrency,1238467902954770432,2020-03-13 14:12:12,IFTTT,en,,Netral,crash of a generation cryptocurrency
55,Crypto Lending Firm Blockfi Adds Support For Buying Cryptos With Cash - CryptoCurrency Guide -… https://t.co/teR3xPSNfJ,1238467851670847488,2020-03-13 14:12:00,stablecoinbuzz,en,,Negatif,crypto lending firm blockfi adds support for buying cryptos with cash  cryptocurrency guide  
56,"Setting The Record Straight For Dash In Japan

https://t.co/8A1KQ5HG2r by @TaoOfSatoshi 

#DashPay #Cryptocurrency #Blockchain",1238467827214008320,2020-03-13 14:11:54,Twitter Web App,en,,Positif,setting the record straight for dash in japan by dashpay cryptocurrency blockchain
57,"BitcoinTalk Forum: The Cryptocurrency Forum That Can Make You Rich 

I made some decent amount of dollars as a memb… https://t.co/7cI9Aw8meC",1238467814824042497,2020-03-13 14:11:51,Revive Social App,en,,Positif,bitcointalk forum the cryptocurrency forum that can make you rich i made some decent amount of dollars as a memb 
58,Bit of delicious irony that cryptocurrency is all the rage now when seems like just yesterday that I was scoffed at… https://t.co/4u45nJ1jhX,1238467813595131909,2020-03-13 14:11:51,Twitter for Android,en,,Positif,bit of delicious irony that cryptocurrency is all the rage now when seems like just yesterday that i was scoffed at 
59,"RT @Marijuana5: Caithness to lead team of Blockchain Researchers and University Scholars to develop AmeriCoin, a US Government Issued Crypt…",1238467760906174466,2020-03-13 14:11:38,Alex Blockchain Bot,en,,Netral, caithness to lead team of blockchain researchers and university scholars to develop americoin a us government issued crypt 
60,Walking in Dubai and saw this bear celebrating 😭 https://t.co/YOWcYJUDSN #CryptoCurrency (from Reddit) https://t.co/UkSVq1MW3A,1238467742203695104,2020-03-13 14:11:34,dlvr.it,en,,Netral,walking in dubai and saw this bear celebrating cryptocurrency from reddit 
61,Nearly time to buy #stocks #cryptocurrency #blockchain,1238467725967724544,2020-03-13 14:11:30,Twitter for Android,en,,Positif,nearly time to buy stocks cryptocurrency blockchain
62,"RT @FinTechZoom: New article: ""Teenager Life Insurance Market - Global Industry Analysis, Size, Share, Growth, Trends and Forecast 2020 – 2…",1238467722322812928,2020-03-13 14:11:29,Alex Blockchain Bot,en,,Positif, new article teenager life insurance market  global industry analysis size share growth trends and forecast 2020 2 
63,RT @reachaffaq: One news from me: Going to launch Cryptocurrency and make it LIVE in April 2020. All set and everything in place. You may a…,1238467716668940290,2020-03-13 14:11:27,arjiebharjie,en,,Positif, one news from me going to launch cryptocurrency and make it live in april 2020 all set and everything in place you may a 
64,RT @digital_mine_: Daily profit for HODLING BTC since 2013 Data taken since 29/10/2018 @ 10:45am (UTC) Updated every hour #bitcoin #btc #cr…,1238467709115027458,2020-03-13 14:11:26,Alex Blockchain Bot,en,,Netral, daily profit for hodling btc since 2013 data taken since 29102018  1045am utc updated every hour bitcoin btc cr 
65,#Innovation has always been the biggest problem of the Indian #startup ecosystem. With SC lifting the ban on… https://t.co/eEU3wGNzgL,1238467695588196354,2020-03-13 14:11:22,Twitter for Android,en,,Netral,innovation has always been the biggest problem of the indian startup ecosystem with sc lifting the ban on 
66,"RT @Prima_felicitas: Re-Emergence of Crypto-currencies in India. 1-Step Closer to 5 Trillion Dollar!
Read full blog at https://t.co/NGDIpkO…",1238467686679695362,2020-03-13 14:11:20,arjiebharjie,en,,Positif, reemergence of cryptocurrencies in india 1step closer to 5 trillion dollar read full blog at 
67,"RT @BitSler: Hello Guys 😍How are you?

I am pretty sure this is how MODs feel when they mute a player and that everyone applauded in the ch…",1238467662276997120,2020-03-13 14:11:14,twitterbot-follower,en,,Positif, hello guys how are you i am pretty sure this is how mods feel when they mute a player and that everyone applauded in the ch 
68,RT @CryptoActuFr: Coinbase met en place du « Bitcoin Batching » pour ses clients https://t.co/W4bO7fJVfq #altcoin #Cryptocurrency #cryptomo…,1238467656619089921,2020-03-13 14:11:13,arjiebharjie,en,,Netral, coinbase met en place du bitcoin batching pour ses clients altcoin cryptocurrency cryptomo 
69,Cryptocurrency exchanges will go live soon. Are you ready to invest? https://t.co/Mca7fLu7WI,1238467655612366848,2020-03-13 14:11:13,WordPress.com,en,,Positif,cryptocurrency exchanges will go live soon are you ready to invest 
71,"RT @coin_guru: Well done Siacoin (SC) HODLers! 👏 

1 SC = 0.0012 USD (+5.65%)

Does this rally have legs? 👢

#Siacoin #SC $SC #cryptocurren…",1238467643780337664,2020-03-13 14:11:10,Twitter for Android,en,,Netral, well done siacoin sc hodlers 1 sc  00012 usd 565 does this rally have legs siacoin sc sc cryptocurren 
72,"RT @Crypto_Potato: Just In: Another BitMEX – FTX Exchange Clash? Or, The Reason Why Bitcoin Crashed To $3,700 Yesterday?

#Bitcoin #cryptoc…",1238467643323097089,2020-03-13 14:11:10,arjiebharjie,en,,Netral, just in another bitmex ftx exchange clash or the reason why bitcoin crashed to 3700 yesterday bitcoin cryptoc 
74,"RT @official_ckm: ✅ How to Buy Litecoin in India 👉 https://t.co/7EyeHujjBI

#blockchain #trading #litecoin #success #Bitcoin #Ether #crypto…",1238467626021552129,2020-03-13 14:11:06,arjiebharjie,en,,Positif, how to buy litecoin in india blockchain trading litecoin success bitcoin ether crypto 
75,"RT @thephreck: I dont know who needs to hear this, but:

LOLOLOL CRYPTOCURRENCY FREEFALL.",1238467620338368517,2020-03-13 14:11:04,Twitter for iPhone,en,,Netral, i dont know who needs to hear this but lololol cryptocurrency freefall
76,#News #Coronavirus #Cryptocurrency Crypto Firms Has to Develop Coronavirus Contingency Plans; NYDFS https://t.co/RPynP6lISf,1238467613811867648,2020-03-13 14:11:03,dlvr.it,en,,Netral,news coronavirus cryptocurrency crypto firms has to develop coronavirus contingency plans nydfs 
78,#Coronavirus #Cryptocurrency Crypto Firms Has to Develop Coronavirus Contingency Plans; NYDFS https://t.co/4qxRZc2RVh,1238467609617547265,2020-03-13 14:11:02,dlvr.it,en,,Netral,coronavirus cryptocurrency crypto firms has to develop coronavirus contingency plans nydfs 
79,"Caithness to lead team of Blockchain Researchers and University Scholars to develop AmeriCoin, a US Government Issu… https://t.co/znLkcvZC2G",1238467577313189890,2020-03-13 14:10:54,Twitter for iPhone,en,,Netral,caithness to lead team of blockchain researchers and university scholars to develop americoin a us government issu 
80,"New article: ""Teenager Life Insurance Market - Global Industry Analysis, Size, Share, Growth, Trends and Forecast 2… https://t.co/BxFLGqnSQv",1238467570065342465,2020-03-13 14:10:52,App for FintechZoom.com,en,,Positif,new article teenager life insurance market  global industry analysis size share growth trends and forecast 2 
81,Daily profit for HODLING BTC since 2013 Data taken since 29/10/2018 @ 10:45am (UTC) Updated every hour #bitcoin… https://t.co/0REDIlLlGF,1238467569058820097,2020-03-13 14:10:52,shohk_com,en,,Netral,daily profit for hodling btc since 2013 data taken since 29102018  1045am utc updated every hour bitcoin 
82,"RT @Melanch10844904: Dutch National Charged in Takedown of Obscene Website Selling Over 2,000 ""Real Rape"" and Child Pornography Videos, Fun…",1238467563299975170,2020-03-13 14:10:51,Twitter Web App,en,,Positif, dutch national charged in takedown of obscene website selling over 2000 real rape and child pornography videos fun 
84,"Let's check out how the #Bitcoin, #Ethereum and #XRP markets are looking after yesterday's historic #cryptocurrency… https://t.co/hr5L4hbWlu",1238467545247756289,2020-03-13 14:10:47,Twitter Web App,en,,Netral,lets check out how the bitcoin ethereum and xrp markets are looking after yesterdays historic cryptocurrency 
85,RT @bananocoin: $BANANO is an easy-to-use next-gen #cryptocurrency with ongoing free&amp;fair distribution through #airdrops and #giveaways tog…,1238467518135709701,2020-03-13 14:10:40,Twitter Web App,en,,Positif, banano is an easytouse nextgen cryptocurrency with ongoing freeampfair distribution through airdrops and giveaways tog 
86,"RT @IrishGirlCrypt1: 🚨#NFT+#Ethereum #Crypto #Giveaway🚨

🎁WINNER GETS 0.03 $ETH &amp; XMoonR GEMSTONE NFT😍

🧜‍♀️Rules:

✅Like &amp; Retweet

✅Follo…",1238467491858452481,2020-03-13 14:10:34,Twitter Web App,en,,Netral, nftethereum crypto giveaway winner gets 003 eth amp xmoonr gemstone nft rules like amp retweet follo 
87,Eng-SL series postponed due to COVID-19 pandemic #bitcoin #cryptocurrency #btc https://t.co/94qVqoTgG3,1238467466537439245,2020-03-13 14:10:28,Bitcoin news 24/7,en,,Negatif,engsl series postponed due to covid19 pandemic bitcoin cryptocurrency btc 
88,"RT @li_technology: Li-power airdrop Round 2 is already started 
Complete simple task and get 100 LIP ($50)
And 10 LIP ($5) each Refferal.
I…",1238467445347647489,2020-03-13 14:10:23,Twitter Web App,en,,Negatif, lipower airdrop round 2 is already started complete simple task and get 100 lip 50 and 10 lip 5 each refferal i 
90,Wanna see something crazy? 👀 The #Nano beta has officially passed 1000 CPS during a stress test 😎 This is real 1st… https://t.co/pZWTjl8QHc,1238467401177534464,2020-03-13 14:10:12,Twitter Web App,en,,Negatif,wanna see something crazy the nano beta has officially passed 1000 cps during a stress test this is real 1st 
92,"Jofra Archer pulled out of England's T20 series against Sout.. 
DailyMailUK - News - Noticias - Bitcoin - CryptoCur… https://t.co/PZBMBiNOO9",1238467368738869248,2020-03-13 14:10:04,MEGNEW,en,,Netral,jofra archer pulled out of englands t20 series against sout dailymailuk  news  noticias  bitcoin  cryptocur 
93,"Coronavirus Tests Europe’s Cohesion, Alliances and Even De.. 
nytimes - News - Noticias - Bitcoin - CryptoCurrency… https://t.co/hsEclFUBpt",1238467365836328961,2020-03-13 14:10:04,MEGNEW,en,,Netral,coronavirus tests europe s cohesion alliances and even de nytimes  news  noticias  bitcoin  cryptocurrency 
94,"RT @USAO_DC: Dutch National Charged in Takedown of Obscene Website Selling Over 2,000 ""Real Rape"" and Child Pornography Videos, Funded by C…",1238467359775604737,2020-03-13 14:10:02,Twitter for Android,en,,Positif, dutch national charged in takedown of obscene website selling over 2000 real rape and child pornography videos funded by c 
95,"RT @cryptobrice: 🚨$10 #ETH #Giveaway 

⭐️Follow Me &amp; @GermanCoin_GCX 
⭐️Like+RT
⭐️Tag a friend

⏰Rolling in 24 hours!!

https://t.co/DzaYil…",1238467357988749312,2020-03-13 14:10:02,Twitter for iPhone,en,,Netral, 10 eth giveaway follow me amp likert tag a friend rolling in 24 hours 
96,The last few days have been quite terrible as the cryptocurrency market shreds every single gain it has amassed sin… https://t.co/dVdUnPADru,1238467343073923073,2020-03-13 14:09:58,webnowcompany,en,,Negatif,the last few days have been quite terrible as the cryptocurrency market shreds every single gain it has amassed sin 
